<?xml version="1.0" encoding="UTF-8"?>
<Services xmlns:xsi="http://www.w3.org/2001/XMLSchema-instance" xsi:noNamespaceSchemaLocation="./services.xsd">
    <Service Name="TestService" Provider="eionet.rpcserver.testservices.TestService">
        <Methods>
            <Method Name="getInfo" Auth="false">
                <Parameters/>
                <Value Type="ARRAY">
                    <Array Type="STRUCT"/>
                </Value>
            </Method>

            <Method Name="getRestricted" Auth="true">
                <Parameters/>
                <Value Type="STRUCT"/>
            </Method>
        </Methods>
    </Service>
</Services>
